speaker-name,start-time,end-time,text,,translation
Gaëtane,00:00:00.00,00:00:35.04,"Je veux dire que je ne le rentiens pas rigueur. Je leur en veux pas, je leur en veux pas. Même ma mère... J'ai pas, J'ai pas de... D'amertume ou de rancœur vis à vis de ma mère. Ma mère, elle a fait ce qu'elle a pu, selon les limites de qu'elle avait. Et Nell, c'est pareil.",,"I mean I don't hold it against them. I don't blame them, I don't blame them. Even my mother... I don't, I don't have any... Any bitterness or resentment towards my mother. My mother, she did what she could, within the limits of what she had. And Nell, it's the same."
Gaëtane,00:00:35.06,00:00:52.05,"Et ma grand mère, elle a été extraordinaire pour moi et. Dora et Jack, un peu moins. Mais je leur en veux pas.",,"And my grandmother, she was extraordinary for me and. Dora and Jack, a little less. But I don't blame them."
Alicia,00:00:52.07,00:01:17.02,"J'ai le sens que Fiona aussi, elle était un peu perdue. ",,I have the feeling that Fiona was a little lost too.
Gaëtane,,,"Oui, elle était le mouton noir de la famille.",,"Yes, she was the black sheep of the family."
Alicia,,,"Oui, c'est devait être dur pour elle.",,"Yes, it must have been hard for her."
Gaëtane,,,Mais je pense qu'elle est partie de sa famille parce qu'elle a voulu partir de sa famille.,,But I think she left her family because she wanted to leave her family.
Gaëtane,00:01:17.04,00:01:27.09,Elle a pas été chassée de sa famille. C'est elle qui a dit moi j'en peux plus de cette famille.,,"She wasn't kicked out of her family. She was the one who said, I can't stand this family anymore."
Gaëtane,00:01:27.11,00:01:28.00,C'est tout.,,That's it.