speaker-name,start-time,end-time,text,,translation
Hélène,00:00:00.09,00:00:03.00,C'était quand même une peinture extrêmement violente.,,It was still an extremely violent painting.
Hélène,00:00:03.40,00:00:14.30,"On peut voir les premiers tableaux... Je me souviens, elle peignée au fond, la, et tu frappé ton tableau après la peinture.",,"We can see the first paintings... I remember, she painted in the back, there, and you hit your canvas after painting it."
Hélène,00:00:14.40,00:00:20.00,"Elle tapait, tapait dessus, avait ramassé un bâton.",,"She was hitting, hitting, had picked up a stick."
Hélène,00:00:21.00,00:00:24.30,Il y avais un violence de son œuvre.,,There was a violence in her work.
Gaëtane,00:00:24.35,00:00:28.00,"Ouais, ouais, j'avais un violence en moi.",,"Yeah, yeah, I had a violence inside me."
Hélène,00:00:28.30,00:00:34.30,"Alors dans ces premières, on peut rencontrer des clous, des boulons, de la terre...",,"So in these first ones, we can find nails, bolts, dirt..."
Gaëtane,00:00:35.00,00:00:36.00,Ouais.,,Yes
Hélène,00:00:37.00,00:00:38.00,"Les premières, les premières peintures...",,"The first, the first paintings..."
Gaëtane,00:00:38.00,00:00:39.16,J'ai fais un paysage crucifié.,,I made a crucified landscape.