speaker-name,start-time,end-time,text,,translation
Gaëtane,00:00:00.12,00:00:37.02,"Alors quand quand j'habitais chez elle, il y avait son fils handicapé qui a été Lorne. Il y avait Andréa. Andréa, elle avait quatre ans, cinq ans, vraiment jeune. Et Lorne devait avoir sept ans et Lorne et elle habitait sur le tapis. Et à la télévision, il y avait un truc Rudolf. Et donc Lorne, c'était. Santa Clause... c'est le Père Noël.",,"So when when I lived with her, there was her handicapped son who was Lorne. There was Andrea. Andrea, she was four, five, really young. And Lorne must have been seven and Lorne and she lived on the carpet. And on TV, there was a Rudolf thing. And so Lorne, it was. Santa Clause... it's Father Christmas."
Gaëtane,00:00:37.04,00:00:42.00,Andréa c'était Rudolf et moi j'étais Bambi et je jouais avec eux.,,Andrea was Rudolf and I was Bambi and I played with them.
Alicia,00:00:42.00,00:00:44.00,Bambi d'une autre histoire.,,Bambi from another story.
Gaëtane,00:00:45.00,00:00:53.00,"Oui, mais c'est ça, c'était moi. Et quand j'étais à l'école",,"Yes, but that's it, that was me. And when I was at school"
Gaëtane,00:00:53.13,00:01:01.11,"À Saturna, ils ne pouvaient pas prononcer le nom Gaëtane.",,"On Saturna, they couldn't pronounce the name Gaëtane."
Gaëtane,00:01:01.13,00:01:19.05,"Et. D'ailleurs, ma famille le prononce très mal parce qu'ils disent Gaëtane... alors que c'est Gaëtane. Et il eux ils disaient c'est pas possible, on peut pas le dire. Alors j'ai dit Bon, vous pouvez m'appeler Bambi si vous voulez.",,"And. Besides, my family pronounces it very badly because they say Gaëtane... when it's Gaëtane. And they said it's not possible, we can't say it. So I said OK, you can call me Bambi if you want."